{
  "$id": "https://local/bytes-and-blades/ammo.en-US.json",
  "version": 1,
  "locale": "en-US",
  "title": "Cyberpunk 2020 Ammo & Add-ons",
  "source": "Cyberpunk 2020 Ammo & Add-ons, revision 1998-11-25",
  "items": [
    {
      "id": "ammo_ammunition_reloads_light_pistol_smg_100",
      "category": "Ammunition Reloads",
      "name": "Light Pistol & SMG (100)",
      "effect": "Standard reload, 100 rounds",
      "description": "Standard reload, 100 rounds",
      "price": 15,
      "compatibility": "Light pistols and SMGs",
      "legacyIds": [
        "weapon_light_handgun_light_smg_ammo_box_100"
      ]
    },
    {
      "id": "ammo_ammunition_reloads_medium_pistol_smg_100",
      "category": "Ammunition Reloads",
      "name": "Medium Pistol & SMG (100)",
      "effect": "Standard reload, 100 rounds",
      "description": "Standard reload, 100 rounds",
      "price": 30,
      "compatibility": "Medium pistols and SMGs",
      "legacyIds": [
        "weapon_medium_handgun_medium_smg_ammo_box_100"
      ]
    },
    {
      "id": "ammo_ammunition_reloads_heavy_pistol_smg_100",
      "category": "Ammunition Reloads",
      "name": "Heavy Pistol & SMG (100)",
      "effect": "Standard reload, 100 rounds",
      "description": "Standard reload, 100 rounds",
      "price": 36,
      "compatibility": "Heavy pistols and SMGs",
      "legacyIds": [
        "weapon_heavy_handgun_heavy_smg_ammo_box_100"
      ]
    },
    {
      "id": "ammo_ammunition_reloads_very_heavy_pistol_100",
      "category": "Ammunition Reloads",
      "name": "Very Heavy Pistol (100)",
      "effect": "Standard reload, 100 rounds",
      "description": "Standard reload, 100 rounds",
      "price": 40,
      "compatibility": "Very heavy pistols",
      "legacyIds": [
        "weapon_very_heavy_handgun_ammo_box_100"
      ]
    },
    {
      "id": "ammo_ammunition_reloads_assault_rifle_100",
      "category": "Ammunition Reloads",
      "name": "Assault Rifle (100)",
      "effect": "Standard reload, 100 rounds",
      "description": "Standard reload, 100 rounds",
      "price": 40,
      "compatibility": "Assault rifles",
      "legacyIds": [
        "weapon_assault_rifle_ammo_box_100"
      ]
    },
    {
      "id": "ammo_ammunition_reloads_airgun_pellets_100",
      "category": "Ammunition Reloads",
      "name": "Airgun Pellets (100)",
      "effect": "Standard pellets",
      "description": "Standard pellets",
      "price": 6,
      "compatibility": "Airguns"
    },
    {
      "id": "ammo_ammunition_reloads_acid_or_drug_pellets_100",
      "category": "Ammunition Reloads",
      "name": "Acid or Drug Pellets (100)",
      "effect": "Payload pellets",
      "description": "Payload pellets",
      "price": 30,
      "compatibility": "Airguns"
    },
    {
      "id": "ammo_ammunition_reloads_needlegun_rounds_100",
      "category": "Ammunition Reloads",
      "name": "Needlegun Rounds (100)",
      "effect": "Standard needles",
      "description": "Standard needles",
      "price": 50,
      "compatibility": "Needleguns"
    },
    {
      "id": "ammo_ammunition_reloads_20mm_cannon_round",
      "category": "Ammunition Reloads",
      "name": "20mm Cannon Round",
      "effect": "One cannon round",
      "description": "One cannon round",
      "price": 25,
      "compatibility": "20mm cannon"
    },
    {
      "id": "ammo_ammunition_reloads_flamethrower_reload",
      "category": "Ammunition Reloads",
      "name": "Flamethrower Reload",
      "effect": "Fuel reload",
      "description": "Fuel reload",
      "price": 50,
      "compatibility": "Flamethrowers"
    },
    {
      "id": "ammo_ammunition_reloads_paintloads_100",
      "category": "Ammunition Reloads",
      "name": "Paintloads (100)",
      "effect": "Paint payloads",
      "description": "Paint payloads",
      "price": 10,
      "compatibility": "Paint weapons"
    },
    {
      "id": "ammo_ammunition_reloads_acid_drug_or_poison_loads_100",
      "category": "Ammunition Reloads",
      "name": "Acid, Drug or Poison Loads (100)",
      "effect": "Payload loads",
      "description": "Payload loads",
      "price": 30,
      "compatibility": "Compatible launchers"
    },
    {
      "id": "ammo_ammunition_reloads_glass_ceramic_or_steel_balls_20",
      "category": "Ammunition Reloads",
      "name": "Glass, Ceramic or Steel Balls (20)",
      "effect": "Ball ammunition",
      "description": "Ball ammunition",
      "price": 5,
      "compatibility": "Ball launchers"
    },
    {
      "id": "ammo_ammunition_types_normal",
      "category": "Ammunition Types",
      "name": "Normal",
      "effect": "No SP or damage modifier",
      "description": "No SP or damage modifier",
      "price": 1,
      "price_label": "1x",
      "compatibility": "Bullets"
    },
    {
      "id": "ammo_ammunition_types_brass_cased",
      "category": "Ammunition Types",
      "name": "Brass Cased",
      "effect": "No SP or damage modifier",
      "description": "No SP or damage modifier",
      "price": 3,
      "price_label": "3x",
      "compatibility": "Bullets"
    },
    {
      "id": "ammo_ammunition_types_plasticase",
      "category": "Ammunition Types",
      "name": "Plasticase",
      "effect": "Poor availability",
      "description": "Poor availability",
      "price": 1,
      "price_label": "1x",
      "compatibility": "Bullets"
    },
    {
      "id": "ammo_ammunition_types_armor_piercing",
      "category": "Ammunition Types",
      "name": "Armor Piercing",
      "effect": "SP x1/2; penetrating damage x1/2",
      "description": "SP x1/2; penetrating damage x1/2",
      "price": 3,
      "price_label": "3x",
      "compatibility": "Bullets"
    },
    {
      "id": "ammo_ammunition_types_api",
      "category": "Ammunition Types",
      "name": "API",
      "effect": "SP x1/2; penetrating damage x1/2; +1d6 then 1d6/2; 50% fire chance",
      "description": "SP x1/2; penetrating damage x1/2; +1d6 then 1d6/2; 50% fire chance",
      "price": 4,
      "price_label": "4x",
      "compatibility": "Bullets"
    },
    {
      "id": "ammo_ammunition_types_dual_purpose",
      "category": "Ammunition Types",
      "name": "Dual-Purpose",
      "effect": "SP x1/2; choose half penetrating damage or x1.5 damage",
      "description": "SP x1/2; choose half penetrating damage or x1.5 damage",
      "price": 4,
      "price_label": "4x",
      "compatibility": "Bullets"
    },
    {
      "id": "ammo_ammunition_types_electrothermal",
      "category": "Ammunition Types",
      "name": "Electrothermal",
      "effect": "Damage x1.5",
      "description": "Damage x1.5",
      "price": 2,
      "price_label": "2x",
      "compatibility": "Bullets"
    },
    {
      "id": "ammo_ammunition_types_hollowpoints",
      "category": "Ammunition Types",
      "name": "Hollowpoints",
      "effect": "SP x2; penetrating damage x1.5",
      "description": "SP x2; penetrating damage x1.5",
      "price": 1.125,
      "price_label": "1.125x",
      "compatibility": "Bullets"
    },
    {
      "id": "ammo_ammunition_types_frag_flechettes",
      "category": "Ammunition Types",
      "name": "Frag Flechettes",
      "effect": "Soft SP x1/2; rare and very illegal",
      "description": "Soft SP x1/2; rare and very illegal",
      "price": 5,
      "price_label": "5x",
      "compatibility": "Bullets"
    },
    {
      "id": "ammo_ammunition_types_rubber_bullets",
      "category": "Ammunition Types",
      "name": "Rubber Bullets",
      "effect": "Stun damage beyond 3m",
      "description": "Stun damage beyond 3m",
      "price": 0.333,
      "price_label": "0.333x",
      "compatibility": "Bullets"
    },
    {
      "id": "ammo_ammunition_types_safety_rounds",
      "category": "Ammunition Types",
      "name": "Safety Rounds",
      "effect": "SP x2; penetrating damage x3; shatter on SP10 or SDP30",
      "description": "SP x2; penetrating damage x3; shatter on SP10 or SDP30",
      "price": 6,
      "price_label": "6x",
      "compatibility": "Bullets"
    },
    {
      "id": "ammo_ammunition_types_electric_fire",
      "category": "Ammunition Types",
      "name": "Electric Fire",
      "effect": "Caseless rounds",
      "description": "Caseless rounds",
      "price": 0.9,
      "price_label": "0.9x",
      "compatibility": "Bullets"
    },
    {
      "id": "ammo_ammunition_types_wasp_flechette",
      "category": "Ammunition Types",
      "name": "Wasp Flechette",
      "effect": "Soft SP x1/2; damage x1d6/2",
      "description": "Soft SP x1/2; damage x1d6/2",
      "price": 10,
      "price_label": "10x",
      "compatibility": "Bullets"
    },
    {
      "id": "ammo_ammunition_types_12mm_anti_personnel",
      "category": "Ammunition Types",
      "name": "12mm Anti-Personnel",
      "effect": "SP x1/2; damage x2",
      "description": "SP x1/2; damage x2",
      "price": 10,
      "price_label": "10x",
      "compatibility": "12mm bullets"
    },
    {
      "id": "ammo_ammunition_types_silver_bullets",
      "category": "Ammunition Types",
      "name": "Silver Bullets",
      "effect": "No mechanical modifier",
      "description": "No mechanical modifier",
      "price": 5,
      "price_label": "5x",
      "compatibility": "Bullets"
    },
    {
      "id": "ammo_ammunition_types_dumdums",
      "category": "Ammunition Types",
      "name": "DumDums",
      "effect": "SP x2; penetrating damage x1.75",
      "description": "SP x2; penetrating damage x1.75",
      "price": 1,
      "price_label": "1x",
      "compatibility": "Bullets"
    },
    {
      "id": "ammo_ammunition_types_titanium",
      "category": "Ammunition Types",
      "name": "Titanium",
      "effect": "SP x1/2",
      "description": "SP x1/2",
      "price": 10,
      "price_label": "10x",
      "compatibility": "Bullets"
    },
    {
      "id": "ammo_ammunition_types_tungsten_carbide",
      "category": "Ammunition Types",
      "name": "Tungsten Carbide",